[
  {"id":"lq-fc-001","clientId":"client-001","entityId":"entity-001","dateOrWeek":"2026-W06","category":"rent","direction":"out","amount":50000,"currency":"EUR","accountId":"lq-acc-001","confidence":"high","sourceType":"recurring","sourceRef":"lq-obl-001","notes":"Monthly office rent","createdAt":"2026-01-25T00:00:00Z","updatedAt":"2026-01-25T00:00:00Z"},
  {"id":"lq-fc-002","clientId":"client-001","entityId":"entity-001","dateOrWeek":"2026-W07","category":"dividend","direction":"in","amount":120000,"currency":"USD","accountId":"lq-acc-002","confidence":"medium","sourceType":"manual","sourceRef":null,"notes":"Q4 dividend from holdings","createdAt":"2026-01-20T00:00:00Z","updatedAt":"2026-01-20T00:00:00Z"},
  {"id":"lq-fc-003","clientId":"client-001","entityId":"entity-002","dateOrWeek":"2026-W06","category":"tax","direction":"out","amount":120000,"currency":"EUR","accountId":"lq-acc-003","confidence":"high","sourceType":"recurring","sourceRef":"lq-obl-003","notes":"Q4 tax payment","createdAt":"2026-01-20T00:00:00Z","updatedAt":"2026-01-20T00:00:00Z"},
  {"id":"lq-fc-004","clientId":"client-002","entityId":"entity-003","dateOrWeek":"2026-W07","category":"capital_call","direction":"out","amount":250000,"currency":"USD","accountId":"lq-acc-006","confidence":"high","sourceType":"pc_call","sourceRef":"pcall-001","notes":"Alpha PE I capital call","createdAt":"2026-01-10T00:00:00Z","updatedAt":"2026-01-10T00:00:00Z"},
  {"id":"lq-fc-005","clientId":"client-002","entityId":"entity-003","dateOrWeek":"2026-W05","category":"rent","direction":"out","amount":85000,"currency":"CHF","accountId":"lq-acc-011","confidence":"high","sourceType":"recurring","sourceRef":"lq-obl-006","notes":"Zurich HQ rent","createdAt":"2026-01-25T00:00:00Z","updatedAt":"2026-01-25T00:00:00Z"},
  {"id":"lq-fc-006","clientId":"client-002","entityId":"entity-003","dateOrWeek":"2026-W09","category":"distribution","direction":"in","amount":500000,"currency":"USD","accountId":"lq-acc-006","confidence":"medium","sourceType":"pc_distribution","sourceRef":"pdist-004","notes":"Expected Iota RE distribution","createdAt":"2026-01-15T00:00:00Z","updatedAt":"2026-01-15T00:00:00Z"},
  {"id":"lq-fc-007","clientId":"client-003","entityId":"entity-004","dateOrWeek":"2026-W06","category":"bill","direction":"out","amount":12000,"currency":"EUR","accountId":"lq-acc-008","confidence":"high","sourceType":"recurring","sourceRef":"lq-obl-010","notes":"IT services","createdAt":"2026-01-20T00:00:00Z","updatedAt":"2026-01-20T00:00:00Z"},
  {"id":"lq-fc-008","clientId":"client-001","entityId":"entity-001","dateOrWeek":"2026-W09","category":"salary","direction":"out","amount":180000,"currency":"EUR","accountId":"lq-acc-001","confidence":"high","sourceType":"recurring","sourceRef":"lq-obl-011","notes":"Staff salaries","createdAt":"2026-01-28T00:00:00Z","updatedAt":"2026-01-28T00:00:00Z"},
  {"id":"lq-fc-009","clientId":"client-001","entityId":"entity-001","dateOrWeek":"2026-W08","category":"coupon","direction":"in","amount":45000,"currency":"EUR","accountId":"lq-acc-001","confidence":"high","sourceType":"manual","sourceRef":null,"notes":"Bond coupon payment","createdAt":"2026-01-15T00:00:00Z","updatedAt":"2026-01-15T00:00:00Z"},
  {"id":"lq-fc-010","clientId":"client-002","entityId":"entity-003","dateOrWeek":"2026-W06","category":"capital_call","direction":"out","amount":150000,"currency":"USD","accountId":"lq-acc-006","confidence":"high","sourceType":"pc_call","sourceRef":"pcall-002","notes":"Beta VC III capital call","createdAt":"2026-01-05T00:00:00Z","updatedAt":"2026-01-05T00:00:00Z"}
]
